<?xml version="1.0" encoding="UTF-8"?>
<!DOCTYPE students SYSTEM "02.dtd" >
<students>
    <student login="IvanovMitarAlex7" course='it.jd.02'>
        <name>Ivanov Alexander</name>
        <nickname>&quot;M&amp;M&apos;s&quot;</nickname>
        <telephone>4586954</telephone>
        <address>
            <country>Belarus</country>
            <city>Minsk</city>
            <street>Lenina 3</street>
        </address>
    </student>

    <student login="zPav16" course='it.jd.02'>
        <name>Zimin Pavel</name>
        <nickname>&lt;Daemond&gt;</nickname>
        <telephone>2569854</telephone>
        <address>
            <country>Belarus</country>
            <city>Grodno</city>
            <street>Gikalo 21</street>
        </address>
    </student>
</students>